{
  "schema_version": "2.0",
  "document_mode": "single-html",
  "output_file": "index.html",
  "content_file": "content.json",
  "deck_plan_file": "deck-plan.json",
  "theme_id": "paper-ink",
  "pages": [
    {
      "page_id": "page.example-flow-kpi",
      "layout_decision": {
        "source": "gallery",
        "reuse_mode": "adapt",
        "layout_id": "paper-ink.flow.pipeline",
        "candidate_evaluations": [
          {
            "layout_id": "paper-ink.flow.pipeline",
            "verdict": "fit",
            "reason": "角色、流程关系、线性原语、容量与槽位顺序均符合本页需求。"
          }
        ]
      },
      "rationale": "四步输入输出是线性流，保留三段结构并替换结果组件，三个语义单元在版式容量内。",
      "slots": [
        {
          "slot_id": "steps",
          "block_id": "block.pipeline",
          "visual_role": "primary",
          "component_decision": {
            "action": "replace",
            "reason": "以真实四步流程 SVG 替换样例中的通用主视觉。"
          },
          "renderer": {
            "provider": "svg",
            "component": "pipeline",
            "content_refs": [
              "item.delivery-process"
            ],
            "data_ref": "item.delivery-process",
            "encode": {
              "order": "steps"
            },
            "theme_adapter": "paper-ink.svg"
          }
        },
        {
          "slot_id": "support",
          "block_id": "block.outcome-kpis",
          "visual_role": "support",
          "component_decision": {
            "action": "keep",
            "reason": "KPI 支撑槽位与样例结构及语义完全一致。"
          },
          "renderer": {
            "provider": "typography",
            "component": "kpi-band",
            "content_refs": [
              "item.delivery-outcomes"
            ],
            "theme_adapter": "paper-ink.typography"
          }
        },
        {
          "slot_id": "takeaway",
          "block_id": "block.flow-takeaway",
          "visual_role": "support",
          "component_decision": {
            "action": "keep",
            "reason": "结论槽位与样例结构及语义完全一致。"
          },
          "renderer": {
            "provider": "typography",
            "component": "takeaway",
            "content_refs": [
              "item.flow-takeaway"
            ],
            "theme_adapter": "paper-ink.typography"
          }
        }
      ],
      "emphasis": {
        "mode": "none",
        "reason": "本页保持默认单色，不声明语义强调焦点。"
      }
    },
    {
      "page_id": "page.example-dense-ui",
      "layout_decision": {
        "source": "gallery",
        "reuse_mode": "adapt",
        "layout_id": "paper-ink.evidence.admin-ui",
        "candidate_evaluations": [
          {
            "layout_id": "paper-ink.evidence.admin-ui",
            "verdict": "fit",
            "reason": "角色、证据关系、空间原语、容量与槽位顺序均符合本页需求。"
          }
        ]
      },
      "rationale": "保留界面、图表、批注与结论的规范顺序，并替换前三个组件以承载真实证据。",
      "slots": [
        {
          "slot_id": "product-ui",
          "block_id": "block.product-ui",
          "visual_role": "primary",
          "component_decision": {
            "action": "replace",
            "reason": "以真实后台界面替换样例中的通用主证据面。"
          },
          "renderer": {
            "provider": "native-html",
            "component": "admin-dashboard",
            "content_refs": [
              "item.product-ui-state"
            ],
            "theme_adapter": "paper-ink.native-html"
          }
        },
        {
          "slot_id": "chart",
          "block_id": "block.embedded-chart",
          "visual_role": "support",
          "component_decision": {
            "action": "replace",
            "reason": "以真实延迟趋势替换样例中的通用图表。"
          },
          "renderer": {
            "provider": "echarts",
            "component": "line",
            "content_refs": [
              "item.product-latency-series"
            ],
            "data_ref": "item.product-latency-series",
            "encode": {
              "x": "time",
              "y": "latency_ms"
            },
            "theme_adapter": "paper-ink.echarts"
          }
        },
        {
          "slot_id": "annotation",
          "block_id": "block.anomaly-note",
          "visual_role": "support",
          "component_decision": {
            "action": "replace",
            "reason": "以异常落点批注替换样例中的通用标注。"
          },
          "renderer": {
            "provider": "svg",
            "component": "elbow-callout",
            "content_refs": [
              "item.product-anomaly-note"
            ],
            "theme_adapter": "paper-ink.svg"
          }
        },
        {
          "slot_id": "takeaway",
          "block_id": "block.ui-takeaway",
          "visual_role": "support",
          "component_decision": {
            "action": "keep",
            "reason": "结论槽位与样例结构及语义完全一致。"
          },
          "renderer": {
            "provider": "typography",
            "component": "takeaway",
            "content_refs": [
              "item.ui-takeaway"
            ],
            "theme_adapter": "paper-ink.typography"
          }
        }
      ],
      "emphasis": {
        "mode": "semantic-focus",
        "content_ref": "item.product-anomaly-note",
        "member_roles": [
          "status",
          "outline",
          "annotation"
        ],
        "reason": "强调异常判断，使状态、轮廓和批注共同指向同一语义焦点。"
      }
    }
  ]
}
